<?xml version="1.0" encoding="UTF-8"?>
<!DOCTYPE student SYSTEM "test05.dtd">
<!-- 자식 엘리먼트가 나열된 순서대로 작성해야 한다. -->

<!-- 정상적인 예제 -->
<!--  
<student>
  <name></name>
  <tel></tel>
</student>
-->

<!--  
<student>
  <name></name>
  <age></age>
  <tel></tel>
</student>
-->

<student>
  <name></name>
  <age></age>
  <tel></tel>
  <tel></tel>
  <tel></tel>
  <tel></tel>
  <address></address>
  <address></address>
  <address></address>
  <address></address>
  <address></address>
</student>